{
  "schema_version": "catlife.focus_feedback.v1",
  "bubble_text": "刚才这段很稳，我会继续安静陪你。",
  "record_summary": "本轮节奏稳定，猫咪已降低动作频率，陪你完成这段专注。",
  "tone": "warm",
  "reaction_hint": "tail_wag_happy",
  "confidence": 0.84,
  "safety": {
    "contains_blame": false,
    "contains_medical_claim": false,
    "contains_sensitive_inference": false
  }
}
